{
  "schema_version": "observer-metric-series/v1",
  "range": "1h",
  "generated_at": "2026-09-09T18:00:05Z",
  "window_start": "2026-09-09T17:00:00Z",
  "window_end": "2026-09-09T18:00:00Z",
  "sample_interval_seconds": 300,
  "limits": { "max_metrics": 6, "max_points_per_series": 2048, "max_response_bytes": 1048576 },
  "privacy": { "data_classification": "PUBLIC_METADATA", "contains_process_identity": false, "contains_log_bodies": false, "remote_upload_eligible": false },
  "requested_metrics": ["process.count"],
  "series": [{
    "metric_id": "process.count", "unit": "count", "support_state": "UNSUPPORTED", "collection_state": "NOT_RUN", "freshness": "UNKNOWN", "reason_code": "COLLECTOR_NOT_IMPLEMENTED", "point_count": 0, "gap_count": 0, "truncated": false, "points": []
  }]
}
